{
  "$schema": "https://json-schema.org/draft/2020-12/schema",
  "title": "KMI Device Family",
  "type": "object",
  "required": ["schemaVersion", "id", "name", "discovery", "identity", "profiles"],
  "$defs": {
    "portDescriptor": {
      "type": "object",
      "required": ["index", "role"],
      "properties": {
        "index": { "type": "integer", "minimum": 1 },
        "role": { "type": "string" },
        "name": { "type": "string" },
        "optional": { "type": "boolean" }
      }
    },
    "servicePort": {
      "type": "object",
      "required": ["direction", "role", "name"],
      "properties": {
        "direction": { "type": "string" },
        "role": { "type": "string" },
        "name": { "type": "string" },
        "optional": { "type": "boolean" }
      }
    },
    "payloadAsset": {
      "type": "object",
      "required": ["id", "type", "targetState", "path"],
      "properties": {
        "id": { "type": "string" },
        "type": {
          "type": "string",
          "enum": ["firmware", "bootloader_entry", "bootloader_installer", "utility"]
        },
        "targetState": { "type": "string", "enum": ["application", "bootloader"] },
        "version": { "type": "string" },
        "path": { "type": "string" },
        "role": {
          "type": "string",
          "description": "Disambiguates multiple payloads of the same type+version that target different MCUs within one multi-MCU device (e.g. KBP4's Central vs Peripheral firmware). Absent/empty means the payload is the family's single primary target for that type - getPayloadPath() only matches role-less payloads unless a specific role is requested, so existing single-MCU families are unaffected. Added 2026-08-15 for KBP4."
        },
        "hardware": { "type": "array", "items": { "type": "string" } },
        "default": { "type": "boolean" },
        "latest": { "type": "boolean" },
        "notes": { "type": "array", "items": { "type": "string" } }
      }
    }
  },
  "properties": {
    "$schema": { "type": "string" },
    "schemaVersion": { "type": "integer", "minimum": 2 },
    "id": { "type": "string" },
    "name": { "type": "string" },
    "summary": { "type": "string" },
    "discovery": {
      "type": "object",
      "required": ["familyMarkers", "safeProbeRoles"],
      "properties": {
        "familyMarkers": { "type": "array", "items": { "type": "string" } },
        "safeProbeRoles": { "type": "object" },
        "avoidProbeRoles": { "type": "array", "items": { "type": "string" } }
      }
    },
    "identity": {
      "type": "object",
      "required": ["manufacturerId", "stateDetection"],
      "properties": {
        "manufacturerId": { "type": "array", "items": { "type": "integer" } },
        "applicationPidLsb": { "type": "array", "items": { "type": "integer" } },
        "bootloaderPidLsb": { "type": "array", "items": { "type": "integer" } },
        "stateDetection": { "type": "object" },
        "versionEncoding": {
          "type": "string",
          "enum": ["standard", "bcd16"],
          "description": "How to decode the bootloader/application version bytes in this family's identity reply. 'standard' (default when absent): each version is 3 bytes read straight as major/minor/patch. 'bcd16': legacy QuNeo-era layout - each version is only 2 bytes in the reply, [patch (LSB), (major<<4)|minor as BCD nibbles (MSB)], sent LSB-first, so the bootloader and app versions pack into 4 contiguous bytes instead of 6. A standard parse of that misaligns (the app's patch lands in bl_ver[2]) and BCD-misreads the MSB (e.g. QuNeo 1.2.31 -> '18.0.0'); see kmiDevice::midiCppIDReplyCallback."
        },
        "notes": { "type": "array", "items": { "type": "string" } }
      }
    },
    "transport": {
      "type": "object",
      "properties": {
        "requiresFlushAfterPreamble": {
          "type": "boolean",
          "description": "Set true when this family's SysEx preamble parser stops reading at a fixed byte count without regard for the 7-bit/8-bit decode's group boundaries (SX_ENCODE_LEN), so the first payload byte of a sendSyxFormattedMessage()-based command can land in the same decode group as the tail of the preamble and be silently dropped unless the sender flushes after the preamble (SysExMessageTX::setFlush(SYX_FLUSH_YES), or firmware_tester's --flush-after-preamble). Discovered on K-Board; also documented for EM Pro Riser in mk_firmware_tester/lib/midi_cpp's own source comments."
        },
        "usesLegacyTrailer": {
          "type": "boolean",
          "description": "Set true when this family's firmware SENDS the legacy trailer: the preamble's length field is the payload length alone, and the payload is followed by a bare 2-byte CRC with no next-packet-length field and therefore no block chaining. The modern form instead counts payload + 4 and follows the payload with a 4-byte TAIL of {next length, crc}, where a non-zero next length chains another block inside the same F0..F7. Unlike requiresFlushAfterPreamble and requiresSignedCrc, which describe what a host must do in BOTH directions, this describes only what the device TRANSMITS - it is a receive-side setting for the host. A product can genuinely differ by direction: SoftStep's sendSyxFormattedMessage() emits the legacy trailer while its own receiver expects the modern one. Getting it wrong desynchronises the reader by 6 bytes, so it CRCs the wrong extent, fails, and leaves the parser mid-stream - which then corrupts the NEXT packet's preamble too, making the fault look intermittent. Confirmed for SoftStep against two independent implementations: the firmware's own MIDI_sysex_tx.c, and kmi_mdm's KMI_Decode (kmiSysEx.cpp), which stores exactly payload.length bytes then two CRC bytes and treats anything further as a payload overrun."
        },
        "requiresSignedCrc": {
          "type": "boolean",
          "description": "Set true when this family's firmware computes its SysEx CRC over signed chars, so every byte >= 0x80 sign-extends before the XOR and the accumulator diverges from the ordinary unsigned calculation (see crc_byte_signed() vs crc_byte() in midi_cpp's utils_crc.h). Which convention a product uses follows its firmware and whoever wrote it - it is NOT implied by the MCU, the architecture, or the product family, so it cannot be inferred and has to be recorded here. Applies in both directions: a host must use the same convention to build outbound packets and to verify inbound ones. A mismatch is invisible while every byte in a message happens to be < 0x80 and then appears the first time a payload or a length field carries a high bit, which makes it look intermittent and payload-dependent. Confirmed on SoftStep 2026-09-10: a PRESET_PAYLOAD reply of 1207 bytes (0x04B7) put 0xB7 in the preamble's own length field, and only the signed CRC (0xAB90) matched what the device sent - the unsigned one gave 0x4560. 12 Step is also known to use a signed CRC but is not yet flagged here, pending a check against its own firmware."
        },
        "firmwareUpdateDefaults": {
          "type": "object",
          "description": "Per-family default chunking/delay profile applied automatically by sendsysex's --fw-update for this family, letting a small fast first window clear the host before a receiver that starts a blocking operation (e.g. a flash erase) as soon as it sees the message header, then settle with a longer gap before the rest of the transfer proceeds at its own steady-state size/delay. Absent means --fw-update uses the tool's ordinary CLI defaults (-cs 512 -cd 100 -pd 500, -fcs/-fgd disabled) for this family, same as before this field existed. Any of these values still lose to an explicit CLI flag (-fcs/-fgd/-cd/-pd) if the user passes one. Added 2026-08-18, generalized from a KBP4-only hardcode - see kbp4.json for the field-by-field rationale.",
          "properties": {
            "firstChunkSize": { "type": "integer", "minimum": 0, "description": "Bytes. Overrides -cs for the very first sub-split window of the first chunk only. 0/absent disables the override." },
            "firstGapDelayMs": { "type": "integer", "minimum": 0, "description": "Milliseconds. Overrides -cd for the single gap following that first window only. 0/absent disables the override." },
            "chunkDelayMs": { "type": "integer", "minimum": 0, "description": "Milliseconds. Default -cd, the minimum wait after sending a chunk before demanding its identity reply (pure pacing - does not affect how long a reply is waited for). Absent leaves the tool's normal -cd default (100). Split 2026-08-25 from also doubling as the reply-wait budget; see idReplyTimeoutMs." },
            "postDelayMs": { "type": "integer", "minimum": 0, "description": "Milliseconds. Default -pd, the wait after the last chunk before closing the port. Absent leaves the tool's normal -pd default (500)." },
            "idReplyTimeoutMs": { "type": "integer", "minimum": 0, "description": "Milliseconds. Default --id-reply-timeout: how long one identity-request attempt waits for a reply before it's considered silent. Absent/0 leaves the tool's normal default (300). Added 2026-08-25." },
            "idReplyResendAttempts": { "type": "integer", "minimum": 0, "description": "Default --id-reply-resend-attempts: how many additional times to resend the identity request and wait idReplyTimeoutMs again after a silent chunk, before the chunk (and then the whole transfer) is considered failed. Absent/0 leaves the tool's normal default (2). Added 2026-08-25." },
            "appRebootMaxAttempts": { "type": "integer", "minimum": 1, "description": "Maximum number of 1-second poll iterations to wait for the device to return to application mode after a firmware transfer. Absent/0 leaves the hardcoded fallback (60). Added 2026-08-27." },
            "rebootsToAppOnFinalChunk": { "type": "boolean", "description": "When true, the device reboots straight into application mode as it commits the final firmware chunk and never answers an identity request on the bootloader port afterwards. --fw-update skips the doomed final-chunk bootloader handshake and relies on its application-port reconnect + version check as the success test, avoiding ~9s of waiting for a reply that structurally cannot come. Absent/false keeps the historical behavior (wait postDelayMs for a final bootloader reply). Added 2026-08-26." },
            "confirmByAppReconnectOnly": { "type": "boolean", "description": "When true, --fw-update confirms success by application-mode reconnect alone and skips the post-update version match. For families whose application firmware does not answer the standard Universal Device Inquiry (e.g. MalletStation / EM Pro Riser, which report version only via a proprietary OSC-over-SysEx message), an identity request in application mode never replies so a version match is impossible; reconnecting on the application port (detected by port name) is the success signal - a device still stuck in the bootloader shows its bootloader port instead. Absent/false keeps the strict version-match confirmation. Added 2026-08-26." },
            "notes": { "type": "array", "items": { "type": "string" } }
          }
        },
        "notes": { "type": "array", "items": { "type": "string" } }
      }
    },
    "payloads": {
      "type": "array",
      "items": { "$ref": "#/$defs/payloadAsset" }
    },
    "profiles": {
      "type": "array",
      "minItems": 1,
      "items": {
        "type": "object",
        "required": ["id", "state", "productStrings", "portLayout"],
        "properties": {
          "id": { "type": "string" },
          "state": { "type": "string", "enum": ["application", "bootloader"] },
          "hardware": { "type": "array", "items": { "type": "string" } },
          "firmware": { "type": "object" },
          "productStrings": { "type": "array", "minItems": 1, "items": { "type": "string" } },
          "notes": { "type": "array", "items": { "type": "string" } },
          "portLayout": {
            "type": "object",
            "required": ["style", "inputs", "outputs"],
            "properties": {
              "style": { "type": "string" },
              "inputs": { "type": "array", "items": { "$ref": "#/$defs/portDescriptor" } },
              "outputs": { "type": "array", "items": { "$ref": "#/$defs/portDescriptor" } },
              "servicePorts": { "type": "array", "items": { "$ref": "#/$defs/servicePort" } }
            }
          }
        }
      }
    }
  }
}