{
  "$schema": "../schemas/kmi_family.schema.json",
  "schemaVersion": 2,
  "id": "kboard",
  "name": "K-Board",
  "summary": "Single-port family whose application and bootloader both report as K-Board; bootloader state is distinguished by PID MSB = 1.",
  "discovery": {
    "familyMarkers": ["K-Board"],
    "safeProbeRoles": {
      "application": ["main"],
      "bootloader": ["bootloader"]
    },
    "avoidProbeRoles": []
  },
  "identity": {
    "manufacturerId": [0, 1, 95],
    "applicationPidLsb": [26],
    "bootloaderPidLsb": [26],
    "stateDetection": {
      "applicationPidMsb": 0,
      "bootloaderPidMsb": 1
    }
  },
  "transport": {
    "requiresFlushAfterPreamble": true,
    "notes": [
      "K-Board's SysEx preamble parser (MIDI_sysex.c: CORE_SX_PACKET_PREAMBLE, in both K-Board_Firmware and K-Board_Bootloader - same shared lineage) stops reading as soon as the fixed 6-byte preamble is decoded, without regard for the 7-bit/8-bit decode's 7-byte group boundaries. Without a flush after the preamble, the first payload byte of a sendSyxFormattedMessage()-based command can land in the same decode group as the tail of the preamble and get silently dropped when the firmware resets its decode buffer right after dispatching.",
      "Confirmed on hardware: firmware_tester --flush-after-preamble (or --device kboard, which reads this field) is required for SYX_CMD_TEST_MODE/SYX_CMD_BURST_MODE payloads to land correctly; without it the command is silently no-op'd, not rejected. See k-board-firmware's .buddy-project/kboard-perf-test-design.md §10.3 for the full investigation."
    ]
  },
  "payloads": [
    {
      "id": "enter_bootloader",
      "type": "bootloader_entry",
      "targetState": "application",
      "path": "syx/K-Board/K-Board_EnterBootloader.syx",
      "notes": ["Requests a reboot into bootloader mode while the device still reports as K-Board."]
    },
    {
      "id": "firmware_1_2_1",
      "type": "firmware",
      "targetState": "bootloader",
      "version": "1.2.1",
      "path": "syx/K-Board/K-Board Firmware v1.2.1.syx",
      "default": true,
      "latest": true,
      "notes": ["Preferred current production K-Board firmware payload."]
    },
    {
      "id": "firmware_9_0_1",
      "type": "firmware",
      "targetState": "bootloader",
      "version": "9.0.1",
      "path": "syx/K-Board/K-Board Firmware v9.0.1.syx",
      "default": false,
      "latest": false,
      "notes": [
        "NOT a production release. Performance-test firmware variant (perf_test branch of k-board-firmware) that emits synthetic MIDI/SysEx traffic on command and disables physical key/bend-pad input, used to stress-test mimic_hub with up to 13 simultaneous K-Boards.",
        "Version 9.0.1 is deliberately out of the normal release sequence so it's unmistakable in an ID reply. Select explicitly with --fw-version 9.0.1; never the implicit default.",
        "See k-board-firmware's .buddy-project/kboard-perf-test-design.md for the full design and SYX_CMD_TEST_MODE/SYX_CMD_BURST_MODE command reference."
      ]
    }
  ],
  "profiles": [
    {
      "id": "application",
      "state": "application",
      "productStrings": ["K-Board"],
      "portLayout": {
        "style": "single_port",
        "inputs": [
          { "index": 1, "role": "main" }
        ],
        "outputs": [
          { "index": 1, "role": "main" }
        ]
      }
    },
    {
      "id": "bootloader",
      "state": "bootloader",
      "productStrings": ["K-Board"],
      "portLayout": {
        "style": "single_port",
        "inputs": [
          { "index": 1, "role": "bootloader" }
        ],
        "outputs": [
          { "index": 1, "role": "bootloader" }
        ]
      },
      "notes": [
        "Bootloader uses the same reported product string as the application; confirm state via PID MSB = 1."
      ]
    }
  ]
}